{
  "$schema": "https://json-schema.org/draft/2020-12/schema",
  "$id": "https://raw.githubusercontent.com/cordisx/cordisx-protocol/main/schemas/marketplace-plugin.v4.schema.json",
  "title": "CordisX Marketplace Plugin Entry v4",
  "type": "object",
  "additionalProperties": false,
  "required": ["$schema", "schemaVersion", "id", "fallbackLocale", "name", "description", "version", "source", "license", "compatibility", "authors"],
  "properties": {
    "$schema": { "const": "https://raw.githubusercontent.com/cordisx/cordisx-protocol/main/schemas/marketplace-plugin.v4.schema.json" },
    "schemaVersion": { "const": 4 },
    "id": { "type": "string", "pattern": "^[a-z0-9][a-z0-9._-]*$", "maxLength": 96 },
    "fallbackLocale": { "$ref": "#/$defs/locale" },
    "name": { "type": "string", "minLength": 1, "maxLength": 80 },
    "description": { "type": "string", "minLength": 1, "maxLength": 280 },
    "localizations": { "type": "object", "maxProperties": 32, "propertyNames": { "$ref": "#/$defs/locale" }, "additionalProperties": { "$ref": "#/$defs/localization" } },
    "version": { "$ref": "plugin-lifecycle-common.v1.schema.json#/$defs/semanticVersion" },
    "source": { "$ref": "plugin-lifecycle-common.v1.schema.json#/$defs/canonicalPublicSource" },
    "homepage": { "$ref": "#/$defs/httpsUrl" },
    "icon": { "$ref": "#/$defs/httpsUrl" },
    "manifest": { "$ref": "#/$defs/httpsUrl" },
    "artifact": {
      "type": "object",
      "additionalProperties": false,
      "required": ["publisherIdentity", "packageNamespace", "packageName", "downloadUrl", "integrity"],
      "properties": {
        "publisherIdentity": { "type": "string", "pattern": "^npm:@[a-z0-9][a-z0-9._-]*$", "maxLength": 128 },
        "packageNamespace": { "type": "string", "pattern": "^@[a-z0-9][a-z0-9._-]*$", "maxLength": 128 },
        "packageName": { "type": "string", "pattern": "^@[a-z0-9][a-z0-9._-]*/[a-z0-9][a-z0-9._-]*$", "maxLength": 214 },
        "downloadUrl": { "type": "string", "format": "uri", "pattern": "^https://[^?#]+$", "maxLength": 2048 },
        "integrity": { "$ref": "plugin-lifecycle-common.v1.schema.json#/$defs/digest" }
      }
    },
    "commerce": { "$ref": "commerce-descriptor.v1.schema.json" },
    "license": { "type": "string", "minLength": 1, "maxLength": 80 },
    "compatibility": { "type": "object", "additionalProperties": false, "required": ["cordisx"], "properties": { "cordisx": { "type": "string", "minLength": 1, "maxLength": 120 } } },
    "authors": { "type": "array", "minItems": 1, "maxItems": 20, "items": { "type": "object", "additionalProperties": false, "required": ["name"], "properties": { "name": { "type": "string", "minLength": 1, "maxLength": 80 }, "url": { "$ref": "#/$defs/httpsUrl" } } } },
    "keywords": { "type": "array", "maxItems": 20, "uniqueItems": true, "items": { "type": "string", "pattern": "^[a-z0-9][a-z0-9-]*$", "maxLength": 32 } }
  },
  "$defs": {
    "httpsUrl": { "type": "string", "format": "uri", "pattern": "^https://", "maxLength": 2048 },
    "locale": { "type": "string", "pattern": "^[A-Za-z]{2,3}(?:-[A-Za-z0-9]{2,8})*$", "maxLength": 48 },
    "localization": { "type": "object", "additionalProperties": false, "minProperties": 1, "properties": { "name": { "type": "string", "minLength": 1, "maxLength": 80 }, "description": { "type": "string", "minLength": 1, "maxLength": 280 }, "authors": { "type": "array", "minItems": 1, "maxItems": 20, "items": { "type": "string", "minLength": 1, "maxLength": 80 } }, "keywords": { "type": "array", "maxItems": 20, "uniqueItems": true, "items": { "type": "string", "pattern": "^[a-z0-9][a-z0-9-]*$", "maxLength": 64 } } } }
  }
}
