{
  "$schema": "https://raw.githubusercontent.com/cordisx/cordisx-protocol/main/schemas/marketplace-plugin.v4.schema.json",
  "schemaVersion": 4,
  "id": "notes-pro",
  "fallbackLocale": "en",
  "name": "Notes Pro",
  "description": "A publisher-authorized notes plugin.",
  "version": "1.3.0",
  "source": "https://github.com/example/notes-pro",
  "license": "Proprietary",
  "compatibility": { "cordisx": "^0.1.0" },
  "authors": [{ "name": "Example Publisher", "url": "https://example.com" }],
  "commerce": {
    "$schema": "https://raw.githubusercontent.com/cordisx/cordisx-protocol/main/schemas/commerce-descriptor.v1.schema.json",
    "schemaVersion": 1,
    "mode": "external-publisher-v1",
    "purchaseUrl": "https://example.com/notes-pro/buy",
    "manageUrl": "https://example.com/notes-pro/account",
    "recoveryUrl": "https://example.com/notes-pro/recover",
    "authorization": { "method": "publisher-grant.v1", "environment": "live" }
  }
}
